{
  "pipeline_id": "cp-psychohistory-2026-10-13-011",
  "department": "psychohistory",
  "research_cycle_id": "psychohistory-2026-10-13-011",
  "module_id": "psy-011-measurement-change-or-system-change",
  "status": "in_progress",
  "phases": {
    "research": {
      "completed": true,
      "belief_value": "P",
      "belief_confidence": 0.75
    },
    "outline": {
      "completed": true,
      "sections": 4,
      "estimated_duration": "40 minutes"
    },
    "content": {
      "completed": true,
      "word_count": 2280,
      "exercises": 5
    },
    "translation": {
      "completed": true,
      "languages": [
        "en",
        "fr",
        "es"
      ]
    },
    "review": {
      "completed": false,
      "feedback": "English draft resting on a snapshot of the quality-trend citation columns, the two producing scripts and the 18 evolution records at Demerzel commit 4b03838800dcd4894f1e026461979bff1d985ca8 (20 count changes: 16 at the one change of citation_source, 4 between rows of the same source), and on a deterministic analysis whose 64 self-checks pass. The alarm rule it applies is an analysis choice and the rows of its first exercise are imaginary. Its reading of the four remaining steps relies on Git history read outside the fixture, and the git-grep count was not recomputed for the runs before the change. Human subject review, learner trial, translation and publication remain pending."
    },
    "publish": {
      "completed": false
    }
  },
  "timestamp": "2026-10-14T00:16:28Z"
}
