{
  "pipeline_id": "cp-data-visualization-2026-10-11-006",
  "department": "data-visualization",
  "research_cycle_id": "data-visualization-2026-10-11-006",
  "module_id": "dv-006-position-length-area-comparisons",
  "status": "in_progress",
  "phases": {
    "research": {
      "completed": true,
      "belief_value": "P",
      "belief_confidence": 0.65
    },
    "outline": {
      "completed": true,
      "sections": 4,
      "estimated_duration": "30 minutes"
    },
    "content": {
      "completed": true,
      "word_count": 1539,
      "exercises": 5
    },
    "translation": {
      "completed": false,
      "languages": ["en"]
    },
    "review": {
      "completed": false,
      "feedback": "English draft prepared against pinned GA snapshots. A bounded AI subject check found and corrected the count of cited historical snapshots. Human subject review, learner attempt, and localization review remain pending."
    },
    "publish": {
      "completed": false
    }
  },
  "timestamp": "2026-10-11T18:08:49Z"
}
