{
  "pipeline_id": "cp-psychohistory-2026-10-13-008",
  "department": "psychohistory",
  "research_cycle_id": "psychohistory-2026-10-13-008",
  "module_id": "psy-008-bursts-are-not-rates",
  "status": "in_progress",
  "phases": {
    "research": {
      "completed": true,
      "belief_value": "P",
      "belief_confidence": 0.75
    },
    "outline": {
      "completed": true,
      "sections": 4,
      "estimated_duration": "40 minutes"
    },
    "content": {
      "completed": true,
      "word_count": 2298,
      "exercises": 5
    },
    "translation": {
      "completed": true,
      "languages": [
        "en",
        "fr",
        "es"
      ]
    },
    "review": {
      "completed": false,
      "feedback": "English draft resting on a snapshot of the 594 archived trigger files at Demerzel commit 4b03838800dcd4894f1e026461979bff1d985ca8 (119 calendar days, 100 active, index of dispersion of the daily counts 39.77 with the sample variance) and on a deterministic analysis whose 35 self-checks pass. The Poisson distribution it uses is a benchmark, not a fitted model, and the three control logs and the transfer-task log are synthetic. The bursts sit in two episodes, so the draft concludes that the mean is not a usable planning description and that this sample cannot say how often bursts occur; its expectation that the busiest days were mostly push events was contradicted by the data. Human subject review, learner trial, translation and publication remain pending."
    },
    "publish": {
      "completed": false
    }
  },
  "timestamp": "2026-10-14T00:32:25Z"
}
