{
  "pipeline_id": "cp-information-theory-2026-10-11-002",
  "department": "information-theory",
  "research_cycle_id": "information-theory-2026-10-11-002",
  "module_id": "inf-002-optick-compact-vector-information-loss",
  "status": "in_progress",
  "phases": {
    "research": {
      "completed": true,
      "belief_value": "P",
      "belief_confidence": 0.75
    },
    "outline": {
      "completed": true,
      "sections": 4,
      "estimated_duration": "35 minutes"
    },
    "content": {
      "completed": true,
      "word_count": 1888,
      "exercises": 5
    },
    "translation": {
      "completed": false,
      "languages": ["en"]
    },
    "review": {
      "completed": false,
      "feedback": "English draft grounded in pinned GA source and an executed independent synthetic fixture calculation. A bounded independent AI subject and answer-key check found no issue in the partition math, scores, links, or five answers. Human subject review, learner attempt, localization, and publication review remain pending. The fixture does not establish full search or deployment behavior."
    },
    "publish": {
      "completed": false
    }
  },
  "timestamp": "2026-10-11T18:54:53Z"
}
