{
  "pipeline_id": "cp-cognitive-science-2026-10-11-002",
  "department": "cognitive-science",
  "research_cycle_id": "cognitive-science-2026-10-11-002",
  "module_id": "cog-002-feedback-integrity-fretboard-recall",
  "status": "in_progress",
  "phases": {
    "research": {
      "completed": true,
      "belief_value": "P",
      "belief_confidence": 0.75
    },
    "outline": {
      "completed": true,
      "sections": 3,
      "estimated_duration": "35 minutes"
    },
    "content": {
      "completed": true,
      "word_count": 1804,
      "exercises": 5
    },
    "translation": {
      "completed": false,
      "languages": ["en"]
    },
    "review": {
      "completed": false,
      "feedback": "English draft prepared from pinned GA SVG fretboard source and a six-position pitch-class check. A bounded independent AI subject and answer-key review confirmed the 5/6 label result and found no issue in the five answers. This is a source observation, not a learner outcome. Human subject review, learner attempt, localization, Learn sync/build, and publication review remain pending."
    },
    "publish": {
      "completed": false
    }
  },
  "timestamp": "2026-10-11T21:56:35Z"
}
