{
  "pipeline_id": "cp-semiotics-2026-10-21-004",
  "department": "semiotics",
  "research_cycle_id": "semiotics-2026-10-21-004",
  "module_id": "sem-004-face-identity-under-reindexing",
  "status": "in_progress",
  "phases": {
    "research": {
      "completed": true,
      "belief_value": "P",
      "belief_confidence": 0.72
    },
    "outline": {
      "completed": true,
      "sections": 4,
      "estimated_duration": "40 minutes"
    },
    "content": {
      "completed": true,
      "word_count": 1626,
      "exercises": 5
    },
    "translation": {
      "completed": false,
      "languages": [
        "en",
        "fr",
        "es",
        "pt",
        "it",
        "de"
      ]
    },
    "review": {
      "completed": false,
      "feedback": "EN/FR/ES/PT/IT/DE drafts have five answered exercises per locale. Original source-bound packet and bounded AI dry-runs apply to their exact revisions; neither is human approval. Subject, fluent-language and human learner reviews, revision-2 task retest, scene integration and public readback remain pending. Translation completion remains false pending language review."
    },
    "publish": {
      "completed": false
    }
  },
  "timestamp": "2026-10-22T00:25:01.719724Z"
}
