{
  "pipeline_id": "cp-network-science-2026-10-11-003",
  "department": "network-science",
  "research_cycle_id": "network-science-2026-10-11-003",
  "module_id": "net-003-worker-lane-coverage-and-fragility",
  "status": "in_progress",
  "phases": {
    "research": {
      "completed": true,
      "belief_value": "P",
      "belief_confidence": 0.7
    },
    "outline": {
      "completed": true,
      "sections": 5,
      "estimated_duration": "35 minutes"
    },
    "content": {
      "completed": true,
      "word_count": 1919,
      "exercises": 5
    },
    "translation": {
      "completed": false,
      "languages": ["en"]
    },
    "review": {
      "completed": false,
      "feedback": "English draft with five answered exercises. Independent AI static graph and answer preflight found no actionable issue. Graph counts are recomputed from the pinned advisory lane policy; the selector replay is a proposed falsifier, not an executed test. Human subject and learner reviews, localization, runtime routing evidence, and publication remain pending."
    },
    "publish": {
      "completed": false
    }
  },
  "timestamp": "2026-10-11T23:20:44Z"
}
