{
  "pipeline_id": "cp-visual-computing-2026-10-12-006",
  "department": "visual-computing",
  "research_cycle_id": "visual-computing-2026-10-12-006",
  "module_id": "vc-006-origami-fold-state-scene-trial",
  "status": "in_progress",
  "phases": {
    "research": {
      "completed": true,
      "belief_value": "P",
      "belief_confidence": 0.6
    },
    "outline": {
      "completed": true,
      "sections": 5,
      "estimated_duration": "40 minutes"
    },
    "content": {
      "completed": true,
      "word_count": 2103,
      "exercises": 5
    },
    "translation": {
      "completed": false,
      "languages": ["en"]
    },
    "review": {
      "completed": false,
      "feedback": "English origami-inspired fold-state trial draft with five answered exercises and pinned GA/Learn evidence. Geometry, material, and fold semantics are checked separately; the numbers and outcomes are synthetic. No folded asset, Godot import, DSL implementation, human subject review, learner trial, localization, or public readback is claimed."
    },
    "publish": {
      "completed": false
    }
  },
  "timestamp": "2026-10-12T05:54:23Z"
}
